name,position,experience_years,skills,education,city,salary_expectation,summary
Юрченко Олег Николаевич,Директор по маркетингу и продажам,10,"маркетинг, продажи, переговоры, стратегия, управление командой (20 чел)",МГУ — экономический факультет,Москва,500000,"Коммерческий директор в компании по продаже ПО. Управляю и маркетингом, и продажами. 20 человек в подчинении. Зарплатные ожидания выше вилки."
Авдеева Кристина Сергеевна,Performance Marketing Manager,4,"Яндекс.Директ, Google Ads, VK Ads, аналитика, unit-экономика, A/B-тесты, бюджет 3 млн/мес",Финансовый университет — маркетинг,Москва,290000,"Performance-маркетолог в B2B SaaS. Бюджет 3 млн/мес. Снизила CPA на 35% за полгода через оптимизацию посадочных и ретаргетинг. Управленческого опыта нет, но готова к росту."
Кузьмин Роман  Алексеевич,руководитель диджитал маркетинга,6,"контекст, тагрет, SEO, email, CRM, управление командой 5 чел, бюджет 3.5 млн",РЭУ Плеханова,москва,350 000,"руковожу маркетигом в IT-компании (B2B, авмтоматизация). Запустил вебинарную ворнку. Сильный в аналитике. Ищу рост."
Смирнова  Алиса Дмитривна,Head of Digital,5,"диджитал-стратегия, performance, контент, email, управление командой (4 человека)",ВШЭ маркетинг,Мск,345000,"Была руководителем диджитал-маркетинга в SaaS для HR. Команда 4 чел бюджет 3 млн. Знаю Mindbox и amoCRM. вебинары -- 25% лидов."
Тарасов Илья,,7,"b2b маркетинг, стратегия, лидген, контент, seo, event, команда 6 чел, бюджет 4.5 млн/мес, Bitrix24",МГТУ Баумана — менеджмент,Москва,,"Директор по маркетингу в IT (облачная инфраструктура). В B2B больше 5 лет. Построил отдел маркетинга с нуля. Зарплату обсуждаю индивидуально"
Беляева Марина  Сергевна,маркетолог / руководитель маркетинга,4,"яндекс директ; гугл адс; seo; email; smm; управление командой (3 чел); бюджет 2-3 млн","высшее, ВШЭ",Москва (м. Тульская),310000,"4 года в b2b. Сейчас в edtech (корпоративное обучение). Ищу компанию покрупнее. Готова выйти через 2 нед."
Волошин Максим Петрвоич,Digital Marketing Lead / Head of Performance,5,"performance-маркетинг, контекстная реклама, SEO, аналитика (GA4 + Метрика + PowerBI), управление командой 4 чел",Финансовый университет,Москва,от 320000,"Руковожу performance в B2B SaaS-компании. Бюджет 4 млн. Вырастил кол-во MQL с 80 до 250/мес. До этого 2 года в digital-агенстве на B2B-клиентах. Есть опыт с вебинарами."
